{
  "contract_version": "UC-STAGE0-1",
  "canonicalization": "UC-CANONICAL-JSON-1",
  "runtime": {
    "implementation": "cpython-stdlib",
    "minimum_version": "3.11",
    "allowed_modules": [
      "hashlib",
      "json",
      "pathlib",
      "shutil",
      "sys"
    ]
  },
  "limits": {
    "maximum_input_bytes": 1048576,
    "maximum_input_count": 6,
    "maximum_json_depth": 32,
    "maximum_path_bytes": 256
  },
  "allowed_operations": [
    "canonicalize-json",
    "sha256",
    "validate-contract",
    "validate-root-seed",
    "validate-path",
    "read-trusted-input",
    "plan-stage1-handoff",
    "interpret-stage1-declaration",
    "render-stage1-boilerplate",
    "hash-stage1-tree",
    "atomic-publish"
  ],
  "prohibited_capabilities": [
    "application-domain-behavior",
    "dynamic-code-loading",
    "environment-dependent-selection",
    "fuzzy-name-resolution",
    "network-access",
    "process-execution",
    "randomness",
    "time-dependent-output",
    "unverified-input-copy"
  ],
  "trusted_inputs": [
    {
      "role": "root-seed",
      "path": "seed/ROOT.seed.json",
      "hash_mode": "canonical-json",
      "sha256": "6368ccedc458f4fd9dfb935f1d14f82a9a6b323798a35ae2c59583b0f0c912af"
    },
    {
      "role": "root-seed-schema",
      "path": "seed/SCHEMA.json",
      "hash_mode": "canonical-json",
      "sha256": "36b3e103f16cdc7897b65049e4c2284fb03983e4391a842df522d3fa9a4e9c8f"
    },
    {
      "role": "stage0-contract-schema",
      "path": "seed/STAGE0_SCHEMA.json",
      "hash_mode": "canonical-json",
      "sha256": "fc296d5816838ca3d6ffacf725e4929a62e614d1fe1bbfbcd86b7954eec97365"
    },
    {
      "role": "stage1-handoff-schema",
      "path": "seed/STAGE1_HANDOFF_SCHEMA.json",
      "hash_mode": "canonical-json",
      "sha256": "8d4f6ab172758d50fd1732c243fe77207f72ff83683fca6643c523897b078e7a"
    },
    {
      "role": "stage0-generation-manifest-schema",
      "path": "seed/STAGE0_GENERATION_MANIFEST_SCHEMA.json",
      "hash_mode": "canonical-json",
      "sha256": "56e9d66d027cb87fd15c814ce1fe58f097cb1f047ff0b97c38fc648eb3fb76cf"
    },
    {
      "role": "stage0-executable",
      "path": "bootstrap/stage0.py",
      "hash_mode": "raw-bytes",
      "sha256": "7150372ad1fdb6eb392edc12157310df4a2d32834537a97eccbbb5f7e585ca87"
    }
  ],
  "external_dependencies": [],
  "stage1_handoff": {
    "format_version": "UC-STAGE1-HANDOFF-1",
    "handoff_file": "stage1-handoff.json",
    "generation_manifest_file": "generation-manifest.json",
    "required_fields": [
      "format_version",
      "stage0",
      "root_seed",
      "trusted_inputs",
      "external_dependencies",
      "stage1_output"
    ]
  }
}
